科目名,学科,開講学期,曜日・時限,単位数,授業形態,実施方法,教授名,到達目標,概要,授業計画,成績評価基準,成績評価結果,配当年次,カテゴリ
情報システム演習実験Ⅱ,情報システムデザイン学科,秋学期,水曜日3講時・水曜日4講時・水曜日5講時,2,演習,面接/Face-to-face,大久保　雅史,・受講生は，講義課目で学んできた情報通信技術やプログラミング技術を有機的に結合し，仕様に沿ったシステム開発を行う際の基本的な態度を身につけることができるになる。 ・受講生は，実験結果や観測現象の分析力を高めることができるようになる。 ・受講生は，実験結果を高い可読性を持つ技術報告書にまとめることができるようになる。,情報システムに関する様々な演習実験を通して，情報システムに関する理解を深めるとともに，実験技術やレポートの書き方，表現能力を身につけることを目的とする。具体的には，下記のテーマについて，初回のガイダンス時に示すスケジュールに従って演習実験を実施する。受講生は班毎に，テーマ1～3をローテーションで行う。 テーマ1：AWSクラウドにおけるシステム構築と開発　（担当：小板） テーマ2：UnityによるVirtual空間の制作　（担当：大久保） テーマ3：機械学習と知識発見　（担当：大崎）,"[{""授業回"": ""1"", ""内容"": ""ガイダンスと授業内課題を，90分のオンデマンド，180分の授業内課題の形で行う．内容は，実験実施における注意事項，実験のテーマ，スケジュール，班分け，レポート等の説明，および，これらの理解の確認 （大久保，大崎，小板）""}, {""授業回"": ""2"", ""内容"": ""演習実験（班ごと・テーマごとに分かれて実施） （大久保，大崎，小板）""}, {""授業回"": ""3"", ""内容"": ""演習実験（班ごと・テーマごとに分かれて実施） （大久保，大崎，小板）""}, {""授業回"": ""4"", ""内容"": ""演習実験（班ごと・テーマごとに分かれて実施） （大久保，大崎，小板）""}, {""授業回"": ""5"", ""内容"": ""演習実験（班ごと・テーマごとに分かれて実施） （大久保，大崎，小板）""}, {""授業回"": ""6"", ""内容"": ""演習実験（班ごと・テーマごとに分かれて実施） （大久保，大崎，小板）""}, {""授業回"": ""7"", ""内容"": ""演習実験（班ごと・テーマごとに分かれて実施） （大久保，大崎，小板）""}, {""授業回"": ""8"", ""内容"": ""演習実験（班ごと・テーマごとに分かれて実施） （大久保，大崎，小板）""}, {""授業回"": ""9"", ""内容"": ""演習実験（班ごと・テーマごとに分かれて実施） （大久保，大崎，小板）""}, {""授業回"": ""10"", ""内容"": ""演習実験（班ごと・テーマごとに分かれて実施） （大久保，大崎，小板）""}, {""授業回"": ""11"", ""内容"": ""演習実験（班ごと・テーマごとに分かれて実施） （大久保，大崎，小板）""}, {""授業回"": ""12"", ""内容"": ""演習実験（班ごと・テーマごとに分かれて実施） （大久保，大崎，小板）""}, {""授業回"": ""13"", ""内容"": ""演習実験（班ごと・テーマごとに分かれて実施） （大久保，大崎，小板）""}, {""授業回"": ""14"", ""内容"": ""演習実験（班ごと・テーマごとに分かれて実施） （大久保，大崎，小板）""}, {""授業回"": ""15"", ""内容"": ""演習実験（班ごと・テーマごとに分かれて実施） （大久保，大崎，小板）""}]","[{""項目"": ""平常点（出席・実験・課題）"", ""割合"": ""25%"", ""詳細"": """"}, {""項目"": ""テーマ1のレポート"", ""割合"": ""25%"", ""詳細"": """"}, {""項目"": ""テーマ2のレポート"", ""割合"": ""25%"", ""詳細"": """"}, {""項目"": ""テーマ3のレポート"", ""割合"": ""25%"", ""詳細"": """"}, {""項目"": ""特記事項"", ""割合"": """", ""詳細"": ""以下の(1)(2)を満たした場合に単位認定の対象とする。(1)全回に出席し，実験を実施して課題を達成する。(2)全テーマのレポートが受理される。""}]","{""登録者数"": ""84"", ""A"": ""53.6"", ""B"": ""44.0"", ""C"": ""2.4"", ""D"": ""0.0"", ""F"": ""0.0"", ""他"": ""0.0"", ""評点平均値"": ""3.5"", ""備考"": """"}",2,必修
情報システム演習実験Ⅲ,情報システムデザイン学科,春学期,月曜日3講時・月曜日4講時・月曜日5講時,2,演習,面接/Face-to-face,田村　晃裕,・受講生は，講義課目で学んできた情報通信技術やプログラミング技術を有機的に結合し，仕様に沿ったシステム開発を行う際の基本的な態度を身につけることができるようになる。 ・受講生は，実験結果や観測現象の分析力を高めることができるようになる。 ・受講生は，実験結果を高い可読性を持つ技術報告書にまとめることができるようになる。,情報システムに関する様々な演習実験を通して，情報システムに関する理解を深めるとともに，実験技術やレポートの書き方，表現能力を身につけることを目的とする。具体的には，下記のテーマについて，初回のガイダンス時に示すスケジュールに従って演習実験を実施する。受講生は班毎に，テーマ1～3を4週ずつローテーションで行う。 テーマ1：自然言語処理　（担当：田村） テーマ2：センサデータからの行動認識　（担当：白浜） テーマ3：マルチエージェントアプローチ　（担当：木村）,"[{""授業回"": ""1"", ""内容"": ""ガイダンス（演習実験における注意事項，演習実験のテーマ，スケジュール，班分け，レポートなどについて説明）と授業内課題（担当：田村）""}, {""授業回"": ""2"", ""内容"": ""演習実験（担当：田村，白浜，木村）""}, {""授業回"": ""3"", ""内容"": ""演習実験（担当：田村，白浜，木村）""}, {""授業回"": ""4"", ""内容"": ""演習実験（担当：田村，白浜，木村）""}, {""授業回"": ""5"", ""内容"": ""演習実験（担当：田村，白浜，木村）""}, {""授業回"": ""6"", ""内容"": ""演習実験（担当：田村，白浜，木村）""}, {""授業回"": ""7"", ""内容"": ""演習実験（担当：田村，白浜，木村）""}, {""授業回"": ""8"", ""内容"": ""演習実験（担当：田村，白浜，木村）""}, {""授業回"": ""9"", ""内容"": ""演習実験（担当：田村，白浜，木村）""}, {""授業回"": ""10"", ""内容"": ""演習実験（担当：田村，白浜，木村）""}, {""授業回"": ""11"", ""内容"": ""演習実験（担当：田村，白浜，木村）""}, {""授業回"": ""12"", ""内容"": ""演習実験（担当：田村，白浜，木村）""}, {""授業回"": ""13"", ""内容"": ""演習実験（担当：田村，白浜，木村）""}, {""授業回"": ""14"", ""内容"": ""追加実験日（担当：田村，白浜，木村）""}, {""授業回"": ""15"", ""内容"": ""まとめ（担当：田村，白浜，木村）""}]","[{""項目"": ""演習実験およびレポート"", ""割合"": ""100%"", ""詳細"": ""・全ての演習実験に出席し，全てのテーマのレポートが受理された場合に，単位認定の対象とする。正当な理由のない遅刻あるいはレポート提出遅延によっても単位は認定されなくなるので注意すること。・演習実験における達成度や理解度に基づいて，各テーマ担当者がそれぞれ100点満点で評価し，それらの平均に基づき最終評価する。・上記の評価ポイントに加えて，演習実験においては真摯な態度が必須である。演習中あるいはレポート作成において不正行為が認められた場合は，単位は認定されなくなるので注意すること。なお，レポートの提出方法や評価基準はガイダンスで詳細に説明するので，それに従うこと。""}]","{""登録者数"": ""106"", ""A"": ""31.1"", ""B"": ""29.2"", ""C"": ""30.2"", ""D"": ""9.4"", ""F"": ""0.0"", ""他"": ""0.0"", ""評点平均値"": ""2.8"", ""備考"": """"}",3,必修
情報システム応用,情報システムデザイン学科,秋学期,月曜日1講時,2,講義,面接/Face-to-face,大久保　雅史,この科目の達成目標として，次の項目があげられる． （1）情報工学の各専門分野の概要を理解する （2）情報工学の最新技術の概要を理解する （3）技術的な文章を論理的かつ簡素にまとめることができる,3年次の学生を対象とする。卒業論文着手の前段階として情報システムデザイン学科の各教員の研究内容ならびに関連研究分野の概要を複数教員のオムニバス形式で学習する． 受講生は各教員が行っている専門分野の具体的な研究内容を知ることで，情報工学の最新技術を理解できるようになり，卒業論文履修の参考とすることができる．,"[{""授業回"": ""1"", ""内容"": ""ガイダンス（小板）""}, {""授業回"": ""2"", ""内容"": ""研究紹介1：応用メディア情報研究室（大久保）""}, {""授業回"": ""3"", ""内容"": ""研究紹介2：応用メディア情報研究室（土屋）""}, {""授業回"": ""4"", ""内容"": ""研究紹介3：ネットワーク情報システム研究室（佐藤）""}, {""授業回"": ""5"", ""内容"": ""研究紹介4：社会情報学研究室（Tanev）""}, {""授業回"": ""6"", ""内容"": ""研究紹介5：共創情報学研究室（大崎）""}, {""授業回"": ""7"", ""内容"": ""研究紹介6：共創情報学研究室（白浜）""}, {""授業回"": ""8"", ""内容"": ""研究紹介7：知能メカトロ情報システム研究室（高橋）""}, {""授業回"": ""9"", ""内容"": ""研究紹介8：音声言語処理機構研究室（田村）""}, {""授業回"": ""10"", ""内容"": ""研究紹介9：社会情報学研究室（木村）""}, {""授業回"": ""11"", ""内容"": ""研究紹介10：ネットワーク情報システム研究室（小板）""}, {""授業回"": ""12"", ""内容"": ""情報システムの現在・過去・未来（佐藤）""}, {""授業回"": ""13"", ""内容"": ""卒業論文への取り組み方（大久保）""}, {""授業回"": ""14"", ""内容"": ""まとめ1（小板）""}, {""授業回"": ""15"", ""内容"": ""まとめ2（小板）""}]","[{""項目"": ""レポート"", ""割合"": ""90%"", ""詳細"": ""各講義時にレポート課題が課され，講義内容の理解度を確認する．ただし，正当な理由なく欠席した回のレポートは受理されない．""}, {""項目"": ""平常点"", ""割合"": ""10%"", ""詳細"": ""講義に対しての積極的な参加を評価する．""}]","{""登録者数"": ""105"", ""A"": ""59.0"", ""B"": ""22.9"", ""C"": ""13.3"", ""D"": ""2.9"", ""F"": ""1.9"", ""他"": ""0.0"", ""評点平均値"": ""3.3"", ""備考"": """"}",3,必修
情報システム概論,情報システムデザイン学科,秋学期,月曜日5講時,2,講義,面接/Face-to-face,白浜　公章,・受講者は，技術進歩の速い情報社会を系統立てて俯瞰・把握するために必要な基礎的素養を習得できるようになる．このために，年月を経ても変わらない情報システムに関する「基礎的」な概念や技術と，社会の変化によって変わる情報システムの「応用」を関係づけて講義する． ・受講者は，テキストベースでコンピュータと対話する基本であり，かつシステム開発・管理等で頻繁に使用されるUNIXコマンドに関する知識と経験を習得できる． ・受講者は，各技術を単なる知識として記憶するのではなく，その成立の背景，考え方を自らの言葉で説明できるようになることが求められる． ・本講義は，覚えなくてはならない技術項目が多い．その記憶と理解のためには，教科書の予習復習は必須である．受講者は，毎回の予復習を欠かさない継続的な勉学態度を持つことが求められる．,情報システムとは，コンピュータを中心とする情報を処理する機器と，情報を伝達するネットワークを組み合わせて，様々なサービスや機能を提供するシステムである．本講義では，情報システムの構成基盤であるコンピュータ・ネットワークを中核とした情報通信技術（ICT: Information Communication Technology），及び情報システムと人間・社会との関わりについて幅広く網羅的に概説する．,"[{""授業回"": ""1"", ""内容"": ""イントロダクション""}, {""授業回"": ""2"", ""内容"": ""情報システムとは""}, {""授業回"": ""3"", ""内容"": ""情報の表現：アナログとディジタル""}, {""授業回"": ""4"", ""内容"": ""情報量と情報の伝達""}, {""授業回"": ""5"", ""内容"": ""情報通信ネットワーク""}, {""授業回"": ""6"", ""内容"": ""情報セキュリティ""}, {""授業回"": ""7"", ""内容"": ""アルゴリズムとプログラミング""}, {""授業回"": ""8"", ""内容"": ""ファイルシステムとデータベース""}, {""授業回"": ""9"", ""内容"": ""コンピュータの仕組み""}, {""授業回"": ""10"", ""内容"": ""実際のコンピュータ""}, {""授業回"": ""11"", ""内容"": ""ユーザインターフェース""}, {""授業回"": ""12"", ""内容"": ""UNIXコマンドによるコンピュータとの対話""}, {""授業回"": ""13"", ""内容"": ""情報システムと社会""}, {""授業回"": ""14"", ""内容"": ""総合評価""}, {""授業回"": ""15"", ""内容"": ""講義の総括""}]","[{""項目"": ""レポート1"", ""割合"": ""25%"", ""詳細"": ""情報システム関連技術に関する調査を課す．""}, {""項目"": ""レポート2"", ""割合"": ""25%"", ""詳細"": ""UNIXコマンドを用いたファイル操作に関する演習課題を課す．""}, {""項目"": ""期末試験"", ""割合"": ""50%"", ""詳細"": ""本講義の内容に関する総合的な理解度を評価する．""}]","{""登録者数"": ""71"", ""A"": ""23.9"", ""B"": ""36.6"", ""C"": ""25.4"", ""D"": ""9.9"", ""F"": ""4.2"", ""他"": ""0.0"", ""評点平均値"": ""2.7"", ""備考"": """"}",1,
情報システム実習,情報システムデザイン学科,秋学期,木曜日5講時,1,実習,面接(特例)/Face-to-face(special),小板　隆浩,この科目の達成目標として，具体的に次のような項目をあげられる。 （１）現代社会に不可欠な情報システムの役割とその機能の実現法の基礎を修得する。 （２）メディア情報を扱う情報システムの能力とその実現法の基礎を修得する。 （３）AI（人工知能）の基礎である機械学習の基礎を修得する。 （３）人の社会活動に伴って生じる社会情報を扱う情報システムの能力とその実現法の基礎を修得する。 （４）情報システム利用者の要望をシステム開発に反映する方法論を修得する。 （５）グループワークを通してシステム開発を行う方法論を修得する。,情報システムとは，企業における業務支援システムから官公庁のデータ管理システム，交通機関の制御システム，金融システム，さらには多種多様な家電システムに至る，コンピュータと利用者が協働することによって新たな価値を創造する広範な価値創造の仕組みのことである。本科目では，そうした情報システムの役割や機能，設計開発における考え方などの基礎を，実習を交えて学習する。情報システムが扱う多種多様な情報や機能に対応して，科目では，音声や映像，テキストなどのメディア情報の処理法や，AI（人工知能）の基礎である機械学習，広く社会で繰り広げられる人間の活動に伴う社会情報の処理法などを，網羅的に扱う。また，利用者が望む情報処理要件をシステムとして具体化していく過程の実習などを通して，単にコンピュータを操作する技能を身につけるのではなく，コンピュータを用いて価値を創造する情報システムという存在の本質を理解することを目指す。 企業において研究開発あるいは情報システム開発の実務経験を有する教員が，高校生などの初学者向け教育にも適した水準の実習を行う。,"[{""授業回"": ""1回目"", ""内容"": ""情報システムデザインの概要（担当：小板）""}, {""授業回"": ""2回目"", ""内容"": ""情報システムの基礎（担当：小板）""}, {""授業回"": ""3回目"", ""内容"": ""情報システムの方法論（担当：小板）""}, {""授業回"": ""4回目"", ""内容"": ""情報システム設計の基礎（担当：小板・川崎）""}, {""授業回"": ""5回目"", ""内容"": ""情報システム開発の方法論（担当：川崎）""}, {""授業回"": ""6回目"", ""内容"": ""情報システムの設計実習１（担当：川崎）""}, {""授業回"": ""7回目"", ""内容"": ""情報システムの設計実習２（担当：川崎）""}, {""授業回"": ""8回目"", ""内容"": ""機械学習の基礎（担当：川崎）""}, {""授業回"": ""9回目"", ""内容"": ""機械学習による処理の基礎（担当：川崎）""}, {""授業回"": ""10回目"", ""内容"": ""機械学習による分析の実習（担当：川崎）""}, {""授業回"": ""11回目"", ""内容"": ""機械学習によるテキスト処理の基礎（担当：田村）""}, {""授業回"": ""12回目"", ""内容"": ""機械学習によるテキスト処理の実習（担当：田村）""}, {""授業回"": ""13回目"", ""内容"": ""機械学習による画像処理の基礎（担当：田村）""}, {""授業回"": ""14回目"", ""内容"": ""機械学習による画像処理の実習（担当：田村）""}, {""授業回"": ""15回目"", ""内容"": ""まとめ（担当：小板）""}]","[{""項目"": ""実習およびレポート"", ""割合"": ""80%"", ""詳細"": ""各回ごとに課題を実施し，授業内容の理解度を確認する。なお，実習中にレポート課題が出されることがある。""}, {""項目"": ""平常点"", ""割合"": ""20%"", ""詳細"": ""原則として全回出席すること。正当な理由のない遅刻あるいは欠席は減点対象とする。""}]",,2,
情報セキュリティ,情報システムデザイン学科,秋学期,水曜日2講時,2,講義,面接/Face-to-face,木村　共孝,（知識）情報処理技術者試験である情報処理安全確保支援士合格に向けた基礎的な幅広い知識を習得できるようになる． （技能）情報セキュリティに関する一般的な問題を総合的に解決できるようになる． （態度）様々なシステムを情報セキュリティの観点から捉えることができるようになる．,安全・安心な情報化社会の実現とその維持のために情報セキュリティは益々重要になってきている。本講義では，情報システムを情報セキュリティの観点から捉える方法論を学ぶことで，情報のセキュリティを確保し維持するための問題把握能力および問題解決能力の基礎を養う。,"[{""授業回"": ""1："", ""内容"": ""情報社会と情報セキュリティ""}, {""授業回"": ""2："", ""内容"": ""コンピュータ犯罪""}, {""授業回"": ""3："", ""内容"": ""コンピュータウィルス""}, {""授業回"": ""4："", ""内容"": ""侵入・攻撃による脅威""}, {""授業回"": ""5："", ""内容"": ""脆弱性""}, {""授業回"": ""6："", ""内容"": ""リスクマネジメント""}, {""授業回"": ""7："", ""内容"": ""侵入検知と防御""}, {""授業回"": ""8："", ""内容"": ""暗号の歴史と基礎""}, {""授業回"": ""9："", ""内容"": ""共通鍵暗号の仕組み""}, {""授業回"": ""10："", ""内容"": ""鍵配送問題,公開鍵暗号の仕組み""}, {""授業回"": ""11："", ""内容"": ""公開鍵暗号の安全性，Diffie-Hellman鍵交換""}, {""授業回"": ""12："", ""内容"": ""一方向ハッシュ関数，メッセージ認証コード""}, {""授業回"": ""13："", ""内容"": ""デジタル署名""}, {""授業回"": ""14："", ""内容"": ""SSL/TLS""}, {""授業回"": ""15："", ""内容"": ""総論""}]","[{""項目"": ""期末試験"", ""割合"": ""60%"", ""詳細"": ""講義内容が理解できているか評価する。""}, {""項目"": ""レポート"", ""割合"": ""40%"", ""詳細"": ""講義の理解度を高めるため，演習の実施とレポートの提出を行う。""}]","{""登録者数"": ""78"", ""A"": ""23.1"", ""B"": ""33.3"", ""C"": ""28.2"", ""D"": ""11.5"", ""F"": ""3.8"", ""他"": ""0.0"", ""評点平均値"": ""2.6"", ""備考"": """"}",3,
情報と社会,情報システムデザイン学科,秋学期,火曜日2講時,2,講義,面接/Face-to-face,小野　景子,「情報システムとは何か」の理解を深めるとともに，最新の情報技術への関心を高め，情報を収集する能力を身につける．,"皆さんは「『システム』とは何か？」「『情報システム』とはどの様なものか？」について，考えたことがあるだろうか？「情報システム」は，コンピュータシステムやプログラムを意味するものではない．「情報システム」をデザインすることは，ユーザインタフェースを設計することではない．「情報システム」は，本来，コンピュータやインターネットとは無関係な概念である．コンピュータとは無関係の「情報システム」も多数存在する． 本講義では，この様な観点から，「社会が求める情報システムとは，どの様なものなのか？」を理解する．具体的には，情報システムは，「社会，組織体または個人の活動を支える適切な情報を，収集し，加工し，伝達するための,人間活動を含む社会的な仕組みである．」とする．世の中の仕組みを情報システムとして捉えることの意味，　そして，情報システムを支えるシステムエンジニアとしての職業（仕事内容），更に，今日の「情報システム」の開発において不可欠である，著作権法，個人情報保護法等など，これら法律に関する初歩的知識を学ぶ．","[{""授業回"": ""１"", ""内容"": ""ガイダンス""}, {""授業回"": ""１"", ""内容"": ""情報システムとは何かについてのレポート""}, {""授業回"": ""２"", ""内容"": ""情報システムとは何か（その2）""}, {""授業回"": ""３"", ""内容"": ""情報システムとは何か（その3）""}, {""授業回"": ""4"", ""内容"": ""著作権法""}, {""授業回"": ""5"", ""内容"": ""ミニテスト１""}, {""授業回"": ""6"", ""内容"": ""情報システムとしてのメディア（その１）""}, {""授業回"": ""7"", ""内容"": ""情報システムとしてのメディア（その２）""}, {""授業回"": ""8"", ""内容"": ""情報システムとして捉えた社会（その１）""}, {""授業回"": ""9"", ""内容"": ""情報システムとして捉えた社会（その２）""}, {""授業回"": ""10"", ""内容"": ""個人情報保護法""}, {""授業回"": ""11"", ""内容"": ""その他のインターネットに関係した法律""}, {""授業回"": ""12"", ""内容"": ""情報システムとは何か（その３）""}, {""授業回"": ""13"", ""内容"": ""情報システムとは何か（その４）""}, {""授業回"": ""14"", ""内容"": ""ミニテスト２""}, {""授業回"": ""15"", ""内容"": ""まとめ""}, {""授業回"": ""15"", ""内容"": ""第１回目のレポートを授業内容を踏まえ修正""}]","[{""項目"": ""情報システムに関するレポート"", ""割合"": ""20%"", ""詳細"": ""6-9回目の学習内容の理解を確認するため，6-9回目は毎回授業中にレポートを提出する．""}, {""項目"": ""ミニテスト（2回）"", ""割合"": ""80%"", ""詳細"": ""１回あたり，40点．""}]","{""登録者数"": ""34"", ""A"": ""11.8"", ""B"": ""29.4"", ""C"": ""14.7"", ""D"": ""20.6"", ""F"": ""23.5"", ""他"": ""0.0"", ""評点平均値"": ""1.9"", ""備考"": """"}",1,
